number,value,datetime_start,datetime_complete,duration,params_dropout,params_grad_clip,params_label_smoothing,params_learning_rate,params_scheduler,params_weight_decay,state
0,1.3633711847682777,2026-08-04 20:50:49.216516,2026-08-04 20:52:42.440402,0 days 00:01:53.223886,0.36599697090570255,0.5,0.05,0.00043284502212938834,cosine,0.0007114476009343421,COMPLETE
1,1.325344335396644,2026-08-04 20:52:42.440901,2026-08-04 20:54:35.144503,0 days 00:01:52.703602,0.09091248360355031,1.0,0.05,0.002595942550311264,none,4.335281794951567e-06,COMPLETE
2,1.3773821182160397,2026-08-04 20:54:35.144982,2026-08-04 20:56:27.697101,0 days 00:01:52.552119,0.09983689107917987,0.0,0.02,0.0005954553793888993,onecycle,0.0002267398652378039,COMPLETE
3,1.3488644432871262,2026-08-04 20:56:27.697460,2026-08-04 20:58:19.958663,0 days 00:01:52.261203,0.34211651325607845,0.5,0.0,0.00032925293631105276,none,1.9634341572933354e-06,COMPLETE
4,1.3778314271080765,2026-08-04 20:58:19.959055,2026-08-04 21:00:12.952335,0 days 00:01:52.993280,0.4847923138822793,0.5,0.05,0.0008488762161408717,onecycle,3.5856126103453987e-06,COMPLETE
5,1.3199150285746137,2026-08-04 21:00:12.952739,2026-08-04 21:02:05.316599,0 days 00:01:52.363860,0.41436875457596467,0.5,0.0,0.00045745782054754043,none,6.516990611177181e-06,COMPLETE
6,1.3913726520618277,2026-08-04 21:02:05.316986,2026-08-04 21:03:56.868081,0 days 00:01:51.551095,0.35342867192380856,1.0,0.0,0.00010218376758008094,onecycle,0.0002795015916508333,COMPLETE
7,1.3555502920171942,2026-08-04 21:03:56.868413,2026-08-04 21:05:49.057984,0 days 00:01:52.189571,0.36480308916903204,1.0,0.02,0.0003375589571206087,onecycle,9.4525713910723e-06,COMPLETE
8,1.3342815022647867,2026-08-04 21:05:49.058322,2026-08-04 21:07:40.900887,0 days 00:01:51.842565,0.012709563372047594,1.0,0.05,0.0007728716861851782,none,1.9170041589170666e-05,COMPLETE
9,1.364858528685118,2026-08-04 21:07:40.901272,2026-08-04 21:09:32.531069,0 days 00:01:51.629797,0.144875726456884,0.5,0.02,0.0002447491657907381,onecycle,1.7019223026554036e-06,COMPLETE
10,1.3962393615432658,2026-08-04 21:09:32.531403,2026-08-04 21:11:23.776327,0 days 00:01:51.244924,0.23813393611775718,0.0,0.0,0.004138265387951077,cosine,4.748459024928747e-05,COMPLETE
11,1.345066904151039,2026-08-04 21:11:23.776760,2026-08-04 21:13:14.831364,0 days 00:01:51.054604,0.4734809381950747,1.0,0.0,0.0025708787145015855,none,7.870414016941037e-06,COMPLETE
12,1.3409352321531103,2026-08-04 21:13:14.831792,2026-08-04 21:15:06.358027,0 days 00:01:51.526235,0.22407819842715998,0.5,0.05,0.001809203101363863,none,4.044574059404959e-05,COMPLETE
13,1.3094506573377664,2026-08-04 21:15:06.358412,2026-08-04 21:16:57.116756,0 days 00:01:50.758344,0.048680078225447454,1.0,0.0,0.001598124879976103,none,1.0747446438207505e-06,COMPLETE
14,1.3068327376640312,2026-08-04 21:16:57.117097,2026-08-04 21:18:48.038909,0 days 00:01:50.921812,0.004012612046842626,0.0,0.0,0.001165055293405376,none,1.2611236054600717e-06,COMPLETE
15,1.3765626505365145,2026-08-04 21:18:48.039234,2026-08-04 21:20:39.022262,0 days 00:01:50.983028,0.01277474740527157,0.0,0.0,0.001518801140754558,none,1.0184360594721678e-06,COMPLETE
16,1.3925074909067132,2026-08-04 21:20:39.022633,2026-08-04 21:22:29.917999,0 days 00:01:50.895366,0.06940641877629378,0.0,0.0,0.0012624605490638573,none,1.0518341862777052e-06,COMPLETE
17,1.3523574179166329,2026-08-04 21:22:29.918353,2026-08-04 21:24:21.206790,0 days 00:01:51.288437,0.1704631408477737,0.0,0.0,0.0009903053868474602,cosine,3.1381149231882142e-06,COMPLETE
18,1.3758487859079354,2026-08-04 21:24:21.207188,2026-08-04 21:26:12.472006,0 days 00:01:51.264818,0.0473233604824976,0.0,0.0,0.003916411228115347,none,2.0721286450187297e-06,COMPLETE
19,1.3977589503810524,2026-08-04 21:26:12.472369,2026-08-04 21:28:04.225336,0 days 00:01:51.752967,0.14085502903696012,1.0,0.0,0.0021481673845904657,none,1.6529987057074453e-05,COMPLETE
20,1.4067789291443071,2026-08-04 21:28:04.225732,2026-08-04 21:29:56.781964,0 days 00:01:52.556232,0.006589607190461727,1.0,0.02,0.0011627005121762264,cosine,1.2068605164306055e-06,COMPLETE
21,1.3499649963123515,2026-08-04 21:29:56.782335,2026-08-04 21:31:48.664645,0 days 00:01:51.882310,0.2675027929807435,0.5,0.0,0.0001726480230951823,none,6.1549789242002044e-06,COMPLETE
22,1.3206748865565812,2026-08-04 21:31:48.665039,2026-08-04 21:33:40.737605,0 days 00:01:52.072566,0.28810185696593177,0.5,0.0,0.0005952037081015562,none,2.710691963082775e-06,COMPLETE
23,1.3613054916050948,2026-08-04 21:33:40.737969,2026-08-04 21:35:33.243263,0 days 00:01:52.505294,0.4257749323996695,0.0,0.0,0.0006128536065174435,none,1.3253346902756226e-05,COMPLETE
24,1.366394717296054,2026-08-04 21:35:33.243645,2026-08-04 21:37:25.636492,0 days 00:01:52.392847,0.20568423906435412,0.0,0.0,0.0014466666431605798,none,3.76556224595486e-05,COMPLETE
25,1.340742264647995,2026-08-04 21:37:25.637014,2026-08-04 21:39:17.949273,0 days 00:01:52.312259,0.4271880090909932,0.5,0.0,0.0004065670435960194,none,6.129178897035189e-06,COMPLETE
26,1.4011690738930656,2026-08-04 21:39:17.949630,2026-08-04 21:41:09.861072,0 days 00:01:51.911442,0.0506316567219246,1.0,0.0,0.003079111802765494,none,1.7177880840316503e-06,COMPLETE
27,1.3916923661430955,2026-08-04 21:41:09.861460,2026-08-04 21:43:01.961072,0 days 00:01:52.099612,0.11400953879289172,0.0,0.0,0.001782132009936774,none,4.425187802816785e-06,COMPLETE
28,1.350045244302481,2026-08-04 21:43:01.961477,2026-08-04 21:44:54.239410,0 days 00:01:52.277933,0.31889842805449636,1.0,0.0,0.00018644510057737066,none,2.5816226769698524e-05,COMPLETE
29,1.3497977659374503,2026-08-04 21:44:54.239822,2026-08-04 21:46:46.909876,0 days 00:01:52.670054,0.40670872877949515,0.5,0.02,0.0007546048826046768,cosine,8.20139834188925e-05,COMPLETE
